{
  "id": "pdf",
  "name": "PDF",
  "description": "A document format commonly used for fixed-layout documents and forms.",
  "category": "document",
  "extension": ".pdf",
  "mime_type": "application/pdf",
  "common_uses": ["Documents", "Forms", "Reports", "Print-ready files"],
  "open_standard": "yes",
  "tags": ["document", "portable", "print"],
  "sources": [
    {
      "title": "IANA media type: application/pdf",
      "url": "https://www.iana.org/assignments/media-types/application/pdf",
      "type": "reference",
      "last_checked": "2026-07-05"
    }
  ],
  "last_checked": "2026-07-05",
  "notes": "Initial entry. Check current ISO and vendor documentation for exact feature support."
}
